{
  "$schema": "./docs/dados/media.manifest.schema.json",
  "versao": 1,
  "gerado": "2026-10-21",
  "rotulos": {
    "render": "Imagem 3D do projeto",
    "executado": "Obra executada",
    "antes": "Antes",
    "depois": "Depois",
    "video": "Vídeo",
    "retrato": "Retrato",
    "marca": "Marca",
    "documentacao": "Documentação interna",
    "nao-usar": "Não usar"
  },
  "registros": [
    {
      "id": "consultorio-jonny-arruda-render-01",
      "arquivo": "SaveClip.App_588442716_17869031958483108_6881159161144977863_n.jpg",
      "tipo": "imagem",
      "projeto": "consultorio-jonny-arruda",
      "natureza": "render",
      "rotulo": "Imagem 3D do projeto",
      "autoriaImagem": "Imagem 3D: Renata Nürnberg",
      "creditoProjeto": "Projeto: Lavina | Coletivo de Arquitetura. Imagem 3D: Renata Nürnberg. Marcenaria: Lazzari Móveis. Pedras: Álamo Marmoraria. Cortinas: Maitê Decorações. Iluminação: AF Eletricidade. Decoração: Espaço Decora by Rita Assunção.",
      "post": {
        "codigo": "DSGdwDDj4Kv",
        "data": "10/12/2025",
        "url": "https://www.instagram.com/p/DSGdwDDj4Kv/"
      },
      "legenda": "Consultório Jonny Arruda | Clínica de obstetrícia\n\nAmbiente pensado para transformar consultas em momentos de cuidado. Um consultório que transmite tranquilidade, segurança e delicadeza desde o primeiro olhar.\n\nProjeto elaborado para - @lavina.co.arq\nImagem foto realista - @arq_renatanurnberg",
      "descricao": "mesa oval de pedra + estantes iluminadas (vista da esquerda)",
      "uso": "Antes & Depois (comparador). Se o João baixar o render do post DSGdwDDj4Kv, vira também o par Projeto × Executado.",
      "problemas": [],
      "edicoes": [],
      "publicavel": true,
      "origemDado": "sessão 1 (arquivo novo, fora do JSON de legendas)",
      "bytes": 167872,
      "sha256": "5727bd304e7b5712c1c651843403ec3b09d6e4e6cc417c596f65cf3caecddd52",
      "dimensoes": {
        "largura": 1440,
        "altura": 1152
      },
      "pares": ["consultorio-projeto-executado-mesa"]
    },
    {
      "id": "consultorio-jonny-arruda-render-02",
      "arquivo": "SaveClip.App_598761174_17869031967483108_7242716098048022537_n.jpg",
      "tipo": "imagem",
      "projeto": "consultorio-jonny-arruda",
      "natureza": "render",
      "rotulo": "Imagem 3D do projeto",
      "autoriaImagem": "Imagem 3D: Renata Nürnberg",
      "creditoProjeto": "Projeto: Lavina | Coletivo de Arquitetura. Imagem 3D: Renata Nürnberg. Marcenaria: Lazzari Móveis. Pedras: Álamo Marmoraria. Cortinas: Maitê Decorações. Iluminação: AF Eletricidade. Decoração: Espaço Decora by Rita Assunção.",
      "post": {
        "codigo": "DSGdwDDj4Kv",
        "data": "10/12/2025",
        "url": "https://www.instagram.com/p/DSGdwDDj4Kv/"
      },
      "legenda": "Consultório Jonny Arruda | Clínica de obstetrícia\n\nAmbiente pensado para transformar consultas em momentos de cuidado. Um consultório que transmite tranquilidade, segurança e delicadeza desde o primeiro olhar.\n\nProjeto elaborado para - @lavina.co.arq\nImagem foto realista - @arq_renatanurnberg",
      "descricao": "vista frontal (estantes, janela, mesa)",
      "uso": "Antes & Depois (comparador). Se o João baixar o render do post DSGdwDDj4Kv, vira também o par Projeto × Executado.",
      "problemas": [],
      "edicoes": [],
      "publicavel": true,
      "origemDado": "sessão 1 (arquivo novo, fora do JSON de legendas)",
      "bytes": 91180,
      "sha256": "751ff2fc24348f3c4abb780d67a788533d56cf41f0a78c0f9b2b44d47319fab1",
      "dimensoes": {
        "largura": 1440,
        "altura": 1006
      },
      "pares": ["consultorio-projeto-executado-estantes"]
    },
    {
      "id": "consultorio-jonny-arruda-antes-01",
      "arquivo": "SaveClip.App_625109164_18422648287184910_6715564860894840792_n.jpg",
      "tipo": "imagem",
      "projeto": "consultorio-jonny-arruda",
      "natureza": "antes",
      "rotulo": "Antes",
      "autoriaImagem": "Fotografia: autoria a confirmar (publicada por @lavina.co.arq)",
      "creditoProjeto": "Projeto: Lavina | Coletivo de Arquitetura. Imagem 3D: Renata Nürnberg. Marcenaria: Lazzari Móveis. Pedras: Álamo Marmoraria. Cortinas: Maitê Decorações. Iluminação: AF Eletricidade. Decoração: Espaço Decora by Rita Assunção.",
      "post": {
        "codigo": "DUUHxO4DhqK",
        "data": "03/02/2026",
        "url": "https://www.instagram.com/p/DUUHxO4DhqK/"
      },
      "legenda": "👉🏽 Arrasta para o lado e acompanhe esse super ANTES E DEPOIS de consultório ginecológico obstétrico.",
      "descricao": "sala de exame antiga",
      "uso": "Antes & Depois (comparador). Se o João baixar o render do post DSGdwDDj4Kv, vira também o par Projeto × Executado.",
      "problemas": [],
      "edicoes": [],
      "publicavel": true,
      "origemDado": "docs/dados/midia-legendas.json",
      "bytes": 246336,
      "sha256": "bf90e979890a3a85b9de66f2b0cdfd40049a05e9c1ae152b9792cf4021283555",
      "dimensoes": {
        "largura": 1200,
        "altura": 1555
      }
    },
    {
      "id": "consultorio-jonny-arruda-antes-02",
      "arquivo": "SaveClip.App_625638741_18422648269184910_684003999544053593_n.jpg",
      "tipo": "imagem",
      "projeto": "consultorio-jonny-arruda",
      "natureza": "antes",
      "rotulo": "Antes",
      "autoriaImagem": "Fotografia: autoria a confirmar (publicada por @lavina.co.arq)",
      "creditoProjeto": "Projeto: Lavina | Coletivo de Arquitetura. Imagem 3D: Renata Nürnberg. Marcenaria: Lazzari Móveis. Pedras: Álamo Marmoraria. Cortinas: Maitê Decorações. Iluminação: AF Eletricidade. Decoração: Espaço Decora by Rita Assunção.",
      "post": {
        "codigo": "DUUHxO4DhqK",
        "data": "03/02/2026",
        "url": "https://www.instagram.com/p/DUUHxO4DhqK/"
      },
      "legenda": "👉🏽 Arrasta para o lado e acompanhe esse super ANTES E DEPOIS de consultório ginecológico obstétrico.",
      "descricao": "escritório antigo",
      "uso": "Antes & Depois (comparador). Se o João baixar o render do post DSGdwDDj4Kv, vira também o par Projeto × Executado.",
      "problemas": [],
      "edicoes": [],
      "publicavel": true,
      "origemDado": "docs/dados/midia-legendas.json",
      "bytes": 320274,
      "sha256": "f43124de86f0b946a8f6b0d90d6f39a6d392420fb862e2a09a8194084dce67a2",
      "dimensoes": {
        "largura": 1200,
        "altura": 1555
      }
    },
    {
      "id": "consultorio-jonny-arruda-antes-03",
      "arquivo": "SaveClip.App_625969940_18422648227184910_369266383071226197_n.jpg",
      "tipo": "imagem",
      "projeto": "consultorio-jonny-arruda",
      "natureza": "antes",
      "rotulo": "Antes",
      "autoriaImagem": "Fotografia: autoria a confirmar (publicada por @lavina.co.arq)",
      "creditoProjeto": "Projeto: Lavina | Coletivo de Arquitetura. Imagem 3D: Renata Nürnberg. Marcenaria: Lazzari Móveis. Pedras: Álamo Marmoraria. Cortinas: Maitê Decorações. Iluminação: AF Eletricidade. Decoração: Espaço Decora by Rita Assunção.",
      "post": {
        "codigo": "DUUHxO4DhqK",
        "data": "03/02/2026",
        "url": "https://www.instagram.com/p/DUUHxO4DhqK/"
      },
      "legenda": "👉🏽 Arrasta para o lado e acompanhe esse super ANTES E DEPOIS de consultório ginecológico obstétrico.",
      "descricao": "divisória antiga",
      "uso": "Antes & Depois (comparador). Se o João baixar o render do post DSGdwDDj4Kv, vira também o par Projeto × Executado.",
      "problemas": [],
      "edicoes": [],
      "publicavel": true,
      "origemDado": "docs/dados/midia-legendas.json",
      "bytes": 190770,
      "sha256": "63e715ae8f30897d7563fcd2bf19b9408ac0cb082b76a0d96c98c78ecc04cf2e",
      "dimensoes": {
        "largura": 922,
        "altura": 1195
      }
    },
    {
      "id": "consultorio-jonny-arruda-antes-04",
      "arquivo": "SaveClip.App_626043387_18422648251184910_5022196412577062581_n.jpg",
      "tipo": "imagem",
      "projeto": "consultorio-jonny-arruda",
      "natureza": "antes",
      "rotulo": "Antes",
      "autoriaImagem": "Fotografia: autoria a confirmar (publicada por @lavina.co.arq)",
      "creditoProjeto": "Projeto: Lavina | Coletivo de Arquitetura. Imagem 3D: Renata Nürnberg. Marcenaria: Lazzari Móveis. Pedras: Álamo Marmoraria. Cortinas: Maitê Decorações. Iluminação: AF Eletricidade. Decoração: Espaço Decora by Rita Assunção.",
      "post": {
        "codigo": "DUUHxO4DhqK",
        "data": "03/02/2026",
        "url": "https://www.instagram.com/p/DUUHxO4DhqK/"
      },
      "legenda": "👉🏽 Arrasta para o lado e acompanhe esse super ANTES E DEPOIS de consultório ginecológico obstétrico.",
      "descricao": "bancada antiga",
      "uso": "Antes & Depois (comparador). Se o João baixar o render do post DSGdwDDj4Kv, vira também o par Projeto × Executado.",
      "problemas": [],
      "edicoes": [],
      "publicavel": true,
      "origemDado": "docs/dados/midia-legendas.json",
      "bytes": 169375,
      "sha256": "f69501f3e975b154bb1c8f9240a6dcf9e309f144914d3b70be06ac32bf90e68d",
      "dimensoes": {
        "largura": 1200,
        "altura": 1555
      },
      "pares": ["consultorio-antes-depois-pia"]
    },
    {
      "id": "consultorio-jonny-arruda-depois-01",
      "arquivo": "SaveClip.App_625681099_18422648260184910_5384839820734369773_n.jpg",
      "tipo": "imagem",
      "projeto": "consultorio-jonny-arruda",
      "natureza": "depois",
      "rotulo": "Depois",
      "autoriaImagem": "Fotografia: autoria a confirmar (publicada por @lavina.co.arq)",
      "creditoProjeto": "Projeto: Lavina | Coletivo de Arquitetura. Imagem 3D: Renata Nürnberg. Marcenaria: Lazzari Móveis. Pedras: Álamo Marmoraria. Cortinas: Maitê Decorações. Iluminação: AF Eletricidade. Decoração: Espaço Decora by Rita Assunção.",
      "post": {
        "codigo": "DUUHxO4DhqK",
        "data": "03/02/2026",
        "url": "https://www.instagram.com/p/DUUHxO4DhqK/"
      },